,date,core_search_term,link,title,text,cluster_assignment_with_9_clusters
44,11/05/2019,amzn,https://seekingalpha.com/article/4302912-tracking-ken-fishers-fisher-asset-management-portfolio-q3-2019-update,Tracking Ken Fisher's Fisher Asset Management Portfolio - Q3 2019 Update,fisher substantial stakes several etfsetns hundreds small positions together account onethird f portfolio article part series provides ongoing analysis changes made kenneth fisher’s f stock portfolio quarterly basis based fisher asset management’s regulatory f form filed please visit tracking kenneth fishers fisher asset management holdings article idea investment style philosophy previous update highlighting fund’s moves q quarter fisher’s f portfolio value increased marginally b b number holdings increased significantly large positions remained steady five largest individual stock positions visa inc nysev apple inc nasdaqaapl amazoncom nasdaqamzn microsoft nasdaqmsft alibaba group holdings nysebaba together account f stock portfolio note fisher manages private client accounts institutional accounts portfolio personalized client requirements beating sp focus many f portfolio performance would performance sum total monies f securities unknown institutions pulled money fisher investments last month following inappropriate comments ken fisher made public know ken fisher check research papers notably behavioral finance investment books stake increases alibaba group holdings baba baba portfolio stake original position q prices q saw twothirds increase prices followed increase next quarter prices stock currently trades stake increase last seven quarters followed another stake increase quarter prices american express axp axp portfolio since original position around shares purchased average cost current stake shares last five quarters seen combined stake increase followed stake increase quarter prices stock stake portfolio home depot hd hd f portfolio position first purchased prices q saw selling prices followed another reduction q prices reversal next quarter stake increase prices followed minor increases last five quarters stock quarter saw stake increase prices salesforcecom crm adobe inc adbe two positions seen large increases last four quarters crm position saw increase q prices another increase next quarter prices stock quarter saw another stake increase prices investors attempting follow crm good option consider research adbe portfolio stake saw increase q prices another increase next quarter prices stock quarter saw another stake increase prices tencent holdings adr otcpktcehy majority tcehy stake purchased q quarter saw share purchase prices stock last two years seen incremental purchases stake increase quarter prices current position shares total sa tot majority tot stake purchased q prices last quarter saw selling prices quarter stake increase prices stock currently visa inc v visa position first purchased much lower prices compared current price size stake tripled last six years incremental purchases almost every quarter position largest stake portfolio apple inc aapl aapl topthree individual stock position built prices original stake increased q prices trimming q prices stock currently trades last two years seen combined increase prices quarter also saw marginal stake increase amazoncom amzn amzn thirdlargest individual stock position portfolio stake stock price risen ninefold holding period costbasis compared current price q saw selling prices another selling q prices three quarters q seen increase prices following quarter saw similar reduction prices minor increases last five quarters microsoft corporation msft msft top five portfolio position longterm stake portfolio well decade last two years seen combined increase prices stock quarter also saw stake increase alphabet inc goog googl goog small position built substantial stake prices stock price increased four times currently trades position stands portfolio reduction q prices q saw stake increase prices followed minor increases last six quarters pfizer inc pfe pfe longterm position portfolio well decadethe original stake almost sold time frame rebuilt next two years prices stock currently last six quarters seen increase prices quarter also saw stake increase johnson johnson jnj jnj portfolio position around twothirds stake purchased prices rest prices stock currently trades stake increase q followed similar reduction q last four quarters seen minor increases cisco systems csco royal dutch shell rdsa rdsb two positions seen large increases q csco stake saw increase prices stock currently rdsa portfolio position increased q prices stock currently trades positions saw minor increases last three quarters intel corporation intc bulk portfolio stake intc built highteens position seen consistent incremental buying since stake increase q prices stock currently last six quarters also seen minor increases walmart stores wmt bulk wmt position purchased q prices q saw stake increase prices followed increase next quarter stock last six quarters also saw combined increase ubs ubs ubs f portfolio position established q prices original stake reduced around onethird q prices q saw aboutturn position increased prices following quarter saw additional stake increase prices q pattern reversed position reduced three quarters q seen twothirds stake increase prices stock currently trades since activity minor quarter saw marginal increase itau unibanco itub position seen twothirds increase q prices quarter also saw stake increase prices astrazeneca plc azn anheuserbusch inbev sa adr bud asml holding asml bhp billiton bbl bnp paribas adr otcqxbnpqy chevron inc cvx costco wholesale cost eli lilly lly exxon mobil xom glaxosmithkline plc adr gsk hdfc bank hdb ing groep nv adr ing jpmorgan chase jpm lvmh moet hennessy adr otcpklvmuy loreal co adr otcpklrlcy merck mrk novonordisk nvo novartis ag nvs oracle corporation orcl rio tinto rio softbank group adr otcpksftby sanofi adr sny sap sap schlumberger ltd slb siemens ag otcpksiegy united technologies utx small positions less f portfolio increased quarter stake decreases taiwan semiconductor tsm tsm longterm f portfolio position large block purchased prices position wavered recent activity follows ten quarters q saw periodic buying last three quarters saw minor trimming stock currently trades procter gamble pg pg longterm f portfolio position portfolio since financial crisis original position increased prices sixyear period also seen periodic buying q saw aboutturn selling prices stock currently trades last two quarters seen minor adjustments hsbc plc hsbc petroleo brasileiro pbr vale sa vale small less portfolio positions reduced quarter portfolio several positions different etns etfs account around f portfolio fisher also large stakes following businesses per latest g filings stratasys ltd ssys atlas air aaww wright medical wmgi veeco instruments veco positions sized range portfolio abb ltd abb ase technology asx ambev abev america movil amx aspen technology azpn basf se adr otcqxbasfy bp plc bp baidu inc bidu banco bilbao vizcaya bbva banco bradesco bbd banco santander san bnp paribas otcqxbnpqy boeing company ba boston beer sam ctripcom ctrp csx corp csx capital one financial cof chemed corp che clevelandcliffs clf compagnie financiere richemont otcpkcfruy conocophillips cop credit agricole sa otcpkcrary domino’s pizza dpz fanuc corp otcpkfanuf freeportmcmoran fcx general electric ge heico corp hei hess corp hes hillrom holdings hrc hitachi ltd otcpkhthiy infosys infy intesa sanpaolo otcpkisnpy jdcom jd kb home kbh littelfuse inc lfus mastercard inc meritage homes mth mitsubishi electric otcpkmielf murata mfg otcpkmraay nestle otcpknsrgy netflix nflx netease inc ntes nvidia corp nvda pool corp pool raymond james financial rjf smc corp otcpksmcay svb financial sivb schneider electric otcpksbgsy scotts miraclegro smg societe generale france otcpkscgly southern copper scco stifel financial sf sumitomo mitsui financial smfg teledyne tdy tokyo electron otcpktoely toro co ttc union pacific unp vinci sa otcpkvcisy weibo corp wb west pharmaceutical wst yelp inc yelp credicorp ltd bap helen troy hele nxp semi nxpi steris plc ste spreadsheet highlights changes fisher’s f stock holdings positions f portfolio individually listed q disclosure amwe long azn baba bidu bp ge gsk intc jd sftby wrote article expresses opinions receiving compensation seeking alpha business relationship company whose stock mentioned article,5
5,10/30/2019,amzn,https://www.benzinga.com/news/19/10/14692664/fedex-ups-begin-the-great-last-mile-delivery-divergence,"FedEx, UPS Begin The Great Last-Mile Delivery Divergence",anyone works parcel delivery business knows life holds three certainties – death taxes ups inc nyse ups fedex corp nyse fdx moving lockstep almost everything first two immutable third one though perhaps much sure tag team still exists launched sevendayaweek deliveries within months ups followed fedexs lead earlier year dropped holiday peak season residential delivery surcharges though took ups two years longer act yet likely see increasing divergences two though smoke clear ups announces rate schedule fedex already nowhere separation profound hotbutton segment lastmile residential delivery years fedex ups relied us postal service usps finalmile delivery parcels two companies inserted deep postal infrastructure deliveries typically made one five days depending various factors services fedexs smartpost ups surepost popular shippers low costs associated using usps network also generated decent revenue carriers though low margins fedex announced general rate increase lastmile deliveries landscape changed fedex said earlier year shift surepost parcels – million per day – ground network end contrast ups said would increase engagement usps coincide launch sevenday delivery schedule january unclear ups tighter knot usps extends sunday deliveries signifies broader commitment existed recent years latter represents shift strategy almost every move ups made towards usps adversarial ups like fedex amazoncom inc nasdaq amzn time diverted parcels lastmile delivery – typically densely populated urban areas – delivery network ups also experimented special zone pricing shorthaul deliveries though initiative hasnt taken years ups embroiled rate service disputes usps postal regulatory commission federal agency oversees usps rate service actions international brotherhood teamsters union represents ups package employees publicly trashed surepost taking delivery business union workers long sought end existence according one source parcel forum dallas ups continue insource lastmile parcels also maintain relationship usps feels pragmatic direction fedex diversion many parcels network seen risky audacious move integrating million pieces per day tall order open question fedex cheaper usps able parcel forum attendees speculated fedex longer wants pay independent home delivery drivers usps wants insource build density betting combined density improvements elimination usps vendor offset cost increases may come bringing business inhouse clear fedex prioritizing control delivery mark taylor manager consulting supply chain consultancy envista corp said parcel forum ravi shanker transportation analyst morgan stanley co nyse ms said forum fedex may need smartpost volumes severed us ground air delivery ties amazon still fedex swapping devil knows devil doesnt according shanker smartpost exists reason said taylor presented two companies overflow crowd said ups done masterful job spinning story surepost faster cheaper service ups inducts parcels deeper usps infrastructure fedex one knows reality jibes message however fedexs credit actions helping close messaging gap taylor said battle high stakes reasons well known – growth ecommerce demands consumers free shipping amazons expanding footprint usps continued presence ecommerce transformed carriercustomer relationship changed way businesses ship businesstoconsumer bc shipping taken control market continue dominate ecommerce even revolutionized bb shipping years past business might adequate visibility inventory thus would place purchase order dozen boxes shipped stored today business order products one two days needed task accomplished day storage room becomes walkin closet image sourced pixabay,5
36,11/04/2019,amzn,https://www.businesswire.com/news/home/20191104005759/en/The-Kacey-Musgraves-Christmas-Show-Premieres-Friday-November-29-on-Amazon-Prime-Video,The Kacey Musgraves Christmas Show Premieres Friday ...,culver city califbusiness wirenasdaqamzn — amazon prime video announced today teaming x grammy awardwinning singersongwriter kacey musgraves christmas themed special titled kacey musgraves christmas show special produced fulwell productions premiere globally friday november marks prime video’s first foray holiday special space kacey musgraves christmas show executive produced ben winston emma conway kacey musgraves jason owen narrated dan levy schitt’s creek kacey musgraves christmas show invites fans musgraves prepares joyful christmas gathering whimsical set dazzling wardrobe influenced artist’s fresh aesthetic equal parts heartwarming cleverly absurd musgraves pays tribute holiday specials past whilst also reinventing christmas special magically modern twist musgraves joined allstar cast friends performances classic original holiday songs festive variety special including fred armisen “silent night” leon bridges “present without bow” camila cabello “rockin’ around christmas tree” james corden “let snow” zooey deschanel “mele kalikimaka” lana del rey “i’ll home christmas” troye sivan worlddebut “glittery” wouldn’t christmas without worldfamous radio city rockettes showcase legendary choreography kickline alongside musgraves number “ribbons bows” special guest kendall jenner also stops spread holiday cheer musgraves counts christmas kacey musgraves christmas show accompanied official soundtrack available amazon music dsps beginning november see full track listing “i say without doubt project unlike anything i’ve ever done before” states musgraves “what started small seed idea one night year ago turned something i’m proud truly brilliant comedic musical guests featured show well grandma vision bring old christmas album life visually create modern fashionable fresh take classic format it’s nostalgic wes andersoninspired reimagining holidays it’s heartfelt funny real can’t wait finally share” “kacey musgraves feels like timeless classic potentially iconic artist” says executive producer ben winston “we wanted make holiday special felt equally timeless classic paying tribute shows past whilst setting trend present kacey musgraves christmas show something proud excited audience see” musgraves experienced whirlwind year following release third studio album golden hour taking home four grammy awards including album year best country album album named one years’ ‘best of” everyone npr time associated press rolling stone pitchfork billboard entertainment weekly variety gq among others musgraves toured extensively support golden hour bringing soldout oh world tour north america uk europe japan china new zealand australia tour recently concluded musgraves’ biggest show date nashville’s bridgestone arena musgraves continues make history firstever female country artist play coachella gone play festivals lollapalooza governors ball austin city limits bonnaroo well global citizen festival mandela south africa celebration golden hour’s success kacey honored billboard’s women music event variety’s power women event recently celebrated opening exhibit colors country music hall fame museum kacey musgraves christmas show let snow featuring james corden countdown – dialogue merry little christmas getting ready – dialogue present without bow featuring leon bridges making list – dialogue rockin’ around christmas tree featuring camila cabello silent night featuring fred armisen christmas makes cry amp dan – dialogue christmas fail – dialogue mele kalikimaka featuring zooey deschanel cookies – dialogue glittery featuring troye sivan i’ll home intro – dialogue i’ll home christmas featuring lana del rey nana – dialogue ribbons bows featuring radio city rockettes social handles facebook amazonprimevideo instagram amazonprimevideo twitter primevideo landing page amazoncomkaceychristmas hashtag kaceychristmas kacey musgraves x grammy awardwinning singersongwriter kacey musgraves released third studio album golden hour march earning musgraves third debut billboard’s top country albums chart distinguishing third artist ever take home album year grammy awards country music association awards academy country music awards musgraves took home four grammy awards album year best country album best country solo performance “butterflies” best country song “space cowboy” musgraves first received massive critical acclaim recognition release goldcertified debut album trailer different park debuted billboard’s top country albums chart earned two grammy awards two cma awards acm award musgraves’ followup album pageant material released earning kacey second debut billboard top country albums chart soaring billboard chart fulwell productions fulwell set lifelong friends ben winston leo pearlman ben turner gabe turner produces creates topquality commercial television feature digital productions march james corden joined company fifth full partner fulwell ’s television slate extensive producer multi emmy awardwinning late late show james corden currently billion views online productions include “drop mic” tbs “sounds like friday night” bbc “carpool karaoke series” apple “sunderland til’ die” netflix “stand cancer “gavin stacey” bbc christmas various shows nominated emmy awards total year partners ben winston james corden gaining nominations individuals respectively company first came public’s attention september release debut feature hands gods lionsgate film received great critical acclaim opened screens ukmade documentary appeared cinemas around world since fulwell’s theatrical film releases include successful sports documentary time class universal pictures huge box office hits one direction us sonycolumbia bolt universal also behind recent documentary feature showtime “hitsville making motown” currently production “cinderella” sony pictures fulwell prides making shows top music sports talent world making broadcast specials artists including bruno mars harry styles sam smith shawn mendes recently produced live global citizens event south africa honor mandela’s th birthday artists including beyoncé jay z oprah prime video prime video premium streaming service offers customers vast collection digital videos—all ease finding love watch one place included prime watch thousands popular movies tv shows including criticallyacclaimed amazon originals emmy awardwinning comedies fleabag marvelous mrs maisel tom clancy’s jack ryan boys homecoming hanna good omens carnival row mindy kaling’s late night donald glover’s guava island academy awardwinning manchester sea salesman academy awardnominated big sick cold war exclusives live sports including thursday night football licensed selfpublished content available countries territories worldwide watch thousands popular movies tv shows including criticallyacclaimed amazon originals emmy awardwinning comedies mindy kaling’s donald glover’s academy awardwinning academy awardnominated exclusives live sports including licensed selfpublished content available countries territories worldwide watch prime video channels prime members add channels us like hbo cinemax starz showtime cbs access nba league pass mlbtv —no extra apps download cable required pay ones want cancel anytime view full list channels available amazoncomchannels prime members add channels us like hbo cinemax starz showtime cbs access nba league pass mlbtv —no extra apps download cable required pay ones want cancel anytime view full list channels available amazoncomchannels rent buy enjoy hundreds thousands titles including newrelease movies entire seasons current tv episodes available amazon customers rent buy enjoy hundreds thousands titles including newrelease movies entire seasons current tv episodes available amazon customers rent buy instant access watch want prime video app smart tv mobile device fire tv fire tablet apple tv chromecast game consoles comcast x web complete list compatible devices visit amazoncomhowtostream watch want prime video app smart tv mobile device fire tv fire tablet apple tv chromecast game consoles comcast x web complete list compatible devices visit amazoncomhowtostream enhanced experiences make every viewing k ultra hd high dynamic range hdrcompatible content go behind scenes favorite movies tv shows exclusive xray access powered imdb save later select mobile downloads offline viewing addition access movies tv shows included prime prime membership includes unlimited fast free shipping options across categories available amazon two million songs thousands playlists stations prime music secure photo storage prime photos unlimited reading prime reading unlimited access digital audiobook catalogue audible channels prime rotating selection free digital games ingame loot twitch prime early access select lightning deals exclusive access discounts select items signup prime find visit amazoncomprime amazon amazon guided four principles customer obsession rather competitor focus passion invention commitment operational excellence longterm thinking customer reviews click shopping personalized recommendations prime fulfillment amazon aws kindle direct publishing kindle fire tablets fire tv amazon echo alexa products services pioneered amazon information visit amazoncomabout follow amazonnews,5
34,11/04/2019,amzn,https://www.fool.com/investing/2019/11/04/the-1-company-that-could-be-amazons-biggest-threat.aspx,The One Company That Could Be Amazon's Biggest Threat,article first published mywallst want access years marketbeating experience one day find mywallsts exclusive inperson november event ten years ago ask average westerners ever heard aliexpress subsidiary alibaba would probably idea talking jump ahead alibaba group nysebaba rise market cap almost billion born ashes dotcom crash led founder thenceo jack company quickly became established ecommerce platform native china ecommerce payments systems cloud services artificial intelligence sectors left alibaba hasnt already established strong presence global scale competing several instances outperforming ubiquitous american counterparts including alphabets google amazoncom nasdaqamzn paypal ebay looking surprise alibaba may one platform could challenge amazons dominance alibaba alibaba grown almost halftrillion dollars ipo subsidiary aliexpress already sells goods chinese retailers customers countries company also process allowing foreign retailers sell products could open massive growth opportunities members chinas hailed bat group baidu alibaba tencent alibaba benefited greatly strict internetcontrolling policies home country chinese government essentially filtering foreign competitors alibaba able gain almost complete control market company expanding globally equity stakes asian markets indonesias tokopedia indias snapdeal well subsidiary lazada — southeast asias largest ecommerce platform amazon seen growth revenue recently accelerated year year second quarter investors currently wary uschina trade war cast doubt stability market led ebbing flowing stocks alibaba amazon alibaba remained relatively stable rides storm amazon disappointed investors improvement stock price year year late october next overall outlook alibaba stock good consumer spending populations asia grow chinas consumer economy rise despite tradewar woes alibaba also improving profit margins slows rapid spending order fuel growth recent years mid total revenue amounted billion billion year net income billion versus billion year previous one main testaments alibabas power fact nearmonopoly worlds largest market china well good standing india ecommerce giant also ability move accepting open european us markets likes amazon struggle gain foothold direction amazon current leader us abroad alibabas expansion threat continue grow although may threat amazons dominance right say cannot win us market eventually lower prices increased foreign trade get shortcut years investing experience one day inperson click find mywallst operates full disclosure policy mywallst staff currently hold long positions alibaba group amazon read full disclosure policy,5
