,date,core_search_term,link,title,text,cluster_assignment_with_9_clusters
0,10/30/2019,amzn,https://marketrealist.com/2019/10/october-stock-prices-amzn-nflx-and-googl/,"October Stock Prices: AMZN, NFLX, and GOOGL",amazon’s cloud computing segment always significant revenue contributor third quarter revenue beat analysts’ estimate marginally eps missed forecast amazon stock tanked earnings release analysts downgraded target price results shocker jeff bezos even lost title world’s richest person third week october amazon stock approached falling back october gained stream october closed fell october amzn released earnings results markets closed day otc overthecounter markets reacted strongly weak earnings release amzn opened october midday stock closed yesterday,3
40,11/05/2019,amzn,https://www.fool.com/investing/2019/11/05/amazons-getting-aggressive-this-holiday-season.aspx,Amazon's Getting Aggressive This Holiday Season,calendar ticked november means officially holiday shopping season amazon nasdaqamzn already taking lions share online retail sales pushing set new sales records even brickandmortar competitors including walmart nysewmt target nysetgt quickly grown digital sales channels competitors offer sameday delivery subscriptions delivery unlimited shipt respectively rival prime benefits amazon target quick expand sameday fulfillment options account third online orders walmarts success online grocery driving force behind strong digital sales growth amazon taken steps last months effort fight back continue growing market share holiday season getting extremely aggressive effort win sales brickandmortar competitors big spending fulfillment amazon made big moves effort fulfill orders quickly five months ago started shipping million items us oneday shipping prime members also reduced price threshold addon items used require customer add item larger order qualify prime shipping benefits efforts far paid accelerating marketplace sales north america fact numbers improved across amazons reporting metrics around online marketplace compare domestic international metrics look firstparty versus thirdparty sales recently amazon announced dropping permonth subscription fee amazonfresh grocery delivery program prime members receive unlimited sameday grocery delivery wider selection items wherever amazonfresh available move appears clear response expansions walmarts delivery unlimited targets shipt course efforts add significant expenses amazon planned spend million extra fulfillment second quarter ramp oneday shipping exceeded number spent even third quarter cfo brian olsavsky told investors expect billion penalty fulfillment efforts fourth quarter beating competition price consumers perceive amazons pricing competitive actually lot time retailer moved away always competing price algorithmic pricing order balance margins sales holiday season however algorithm says price items lower competitors amazon consistently shows lower prices everyone else according recent study profitero walmarts average prices closest still higher average targets prices higher allimportant holiday category toys prices little closer walmart prices higher targets within walmart gotten aggressive pricing lately offering subsidize prices thirdparty merchants online marketplace target meanwhile rolled new rewards program offering shoppers discounts future purchases shopping trip today explains somewhat higher pricing amazons pricing ought fuel growth unit sales top oneday sameday shipping initiatives means investors fourth quarter see amazon investing lot fulfillment pricing means bottom line suffer result indeed olsavsky forecast operating profit billion billion quarter compares billion q last year analysts expecting operating profit billion average amazon reported earnings last month management believes best move business long run big investment right longterm decision customers ceo jeff bezos wrote thirdquarter earnings release amazon run play several times always resulted growing prime membership base increasing share ecommerce market competition shows really eat amazons dominance investors shouldnt worry retail giant continuing act like growth company investing future,3
49,10/30/2020,msft,https://www.investopedia.com/microsoft-msft-overdue-for-intermediate-correction-5072035,Microsoft (MSFT) Overdue for Intermediate Correction,dow component microsoft corporation msft reports earnings wednesdays closing bell wall street analysts expecting earnings per share eps fiscal fourth quarter revenue billion stock rose microsoft beat top bottomline third quarter estimates april added gains julys alltime high consolidating near price level ahead earnings news perfect position break reaction strong metrics key takeaways microsoft stock booked outstanding returns past four years earnings profits held well despite pandemic headwinds technical readings warn stock overbought overdue correction pandemic barely affected mr soffee second strongest component dow jones industrial average behind apple inc aapl microsoft beaten earnings estimates nearly every quarter ranks among elite big tech stocks three years outstanding returns stifel analyst brad reback added strong optimism heading report noting expect healthy upside epsrevenue believe microsofts various properties azureofficegaming net short longterm beneficiaries pandemic pricetoearnings ratio pe ratio ratio valuing company measures current share price relative pershare earnings eps pe ratio also sometimes known price multiple earnings multiple microsoft longterm chart – tradingviewcom stock ended strong uptrend splitadjusted december marking high wasnt challenged next years ahead steep downtrend initially found support upper teens underperformed middecade bull market topping mids ahead major decline posted year low economic collapse took four years stock complete retracement high steady upside stalled three points peak ahead historic breakout following presidential election signaled start market leadership channeled uptick underpinned broad institutional sponsorship rally paused october resumed start making rapid progress february high rolled world markets hanging tough sevenmonth low march microsoft shortterm outlook powerful recovery wave second quarter stalled three points february high may ahead june breakout attracted steady buying interest stock added another points julys alltime high eased holding pattern ahead evenings confessional microsoft trading seven points peak quiet session could easily break reaction strong report however month bollinger band® signaling need caution hugging top band past months specifically july price bar stretched outside top band setting overbought technical reading raises odds intermediate correction hard tell current view price action generated identical signal february reversal carved long top shadow point decline center band bollinger band® technical analysis tool defined set trendlines plotted two standard deviations positively negatively away simple moving average sma securitys price specific metrics adjusted user preferences bottom line microsoft firing cylinders lifting second slot dow component performance stock extremely overbought need consolidation correction even tonights earnings release could easily trigger strong shortterm buythenews reaction disclosure author held positions aforementioned securities time publication,3
20,11/01/2019,amzn,https://finance.yahoo.com/news/time-buy-facebook-fb-stock-225210099.html,Time to Buy Facebook (FB) Stock After Earnings Despite Political Worries?,facebook fb shares jumped past month social company recently topped quarterly estimates amid ongoing political scrutiny question investors buy facebook stock right q overview facebook’s q fiscal sales jumped hit billion top estimate fb’s adjusted quarterly earnings per share also crushed per share marked climb q perhaps importantly facebook’s daily active users surged billion maus popped billion facebook’s monthly expansion matched q q dau’s growth rate came higher helps prove wall street investors people still want part facebook despite negativity surrounding social media company ceo mark zuckerberg facebook doesn’t break specific platforms doubt purchase instagram billion proven steal facebook expects roughly billion people use least one “family services” month includes namesake platform instagram whatsapp messenger backlash everything else facebook fire washington nearly two years zuckerberg’s company summer paid historic billion federal trade commission fine still faces antitrust reviews part larger us government probe tech giants company’s founder chief executive recently spoke front house financial services committee facebook’s plan dive cryptocurrency regulators fb’s plans roll blockchainbased cryptocurrency known libra roughly onequarter original partners including likes mastercard paypal pypl visa v backed amid political pushback story continues zuckerberg still wants go forward cryptocurrency even plans fall facebook currently exists invaluable advertisers marketers around world fb makes roughly money advertising poised become even important consumers become harder reach nonad supported streaming world features spotify spot netflix nflx amazon amzn apple aapl soon enough disney dis att comcast cmcsa instance facebook projected remain world’s secondlargest seller digital ads behind google googl front chinese ecommerce powerhouse alibaba baba plus digital advertising expected climb total global ad market according emarketer investors note zuckerberg came fire recent decision continue allow uncensored political ads run across facebook’s various platforms twitter twtr ceo jack dorsey announced seeming effort stand contrast much larger rival would ban political ads yet twtr stock plummeted nearly since posted disappointing results october zuckerberg took stance acknowledged might put company spotlight election cycle spoke relatively openly facebook’s earnings call side free expression ceo also noted fb “make structural changes build rigorous privacy program set new standard” industry part ftc settlement whole opening statement facebook’s conference call focused decision run pollical ads zuckerberg noted money given company estimated “ads politicians less revenue” “in democracy dont think right private companies censor politicians news” zuckerberg said q outlook beyond facebook makes roughly money us canada nearly europe even though user growth comes outside saturated markets still facebook’s maus europe jumped million q million million sequentially meanwhile us canada base climbed million million million last quarter top menlo park californiaheadquartered company’s average revenue per user hit vital metric investors pay close attention looking ahead current zacks consensus estimates call facebook’s fourth quarter sales jump billion fb’s fullyear fiscal revenue projected climb billion billion company’s ’s sales expected climb roughly higher touch billion important note estimates would represent facebook’s slowest sales growth public firm example fb’s sales jumped wall street traders seen slowdown coming clearly accepted company churn kind growth forever meanwhile fb’s adjusted q earnings projected pop fullyear eps figure still expected slip spends improve security expand said facebook’s fiscal earnings expected soar projection bottom line facebook seen earnings revisions trend wrong direction following q release fb stock currently zacks rank hold sports “a” grade growth style scores system despite climb jump last months facebook closed friday week highs top fb’s valuation picture remains strong x forward month zacks consensus earnings estimates marks discount industry’s x average threeyear median x x high therefore deal political uncertainty might want take bite fb stock best stocks next days released experts distill elite stocks current list zacks rank strong buys deem tickers “most likely early price pops” since full list beaten market x average gain per year sure give handpicked immediate attention see want latest recommendations zacks investment research today download best stocks next days click get free report walt disney company dis free stock analysis report netflix inc nflx free stock analysis report amazoncom inc amzn free stock analysis report alibaba group holding limited baba free stock analysis report facebook inc fb free stock analysis report alphabet inc googl free stock analysis report twitter inc twtr free stock analysis report paypal holdings inc pypl free stock analysis report att inc free stock analysis report comcast corporation cmcsa free stock analysis report apple inc aapl free stock analysis report visa inc v free stock analysis report mastercard incorporated free stock analysis report spotify technology sa spot free stock analysis report read article zackscom click zacks investment research,3
19,11/01/2019,amzn,https://www.fool.com/investing/2019/11/01/analyst-says-buy-roku-now-even-after-335-gains-so.aspx,"Analyst Says Buy Roku Now, Even After 335% Gains So Far This Year",roku nasdaqroku fire year youd think company couldnt go higher another analyst opinion sends stock soaring roku gained earlier year fears regarding upcoming competition sent shares plummeting even precipitous fall shares far bullish call sent stock another monday analyst calling foul saying wave selling overdone fears competition misinformed worth think hes right roku massive opportunity thats getting started one investors dont fully understand another roku bull latest bullish prognostication comes bank america merrill lynch analyst ziv israel initiated coverage streaming pioneer buy rating price target monday israel believes recent selloff overdone worries competition based misunderstanding analyst posits roku benefits growing competition among streaming services increasing consumer demand smart tvs missing point one things sent roku stock reeling recent months fear regarding competition streaming services horizon likes apple disney apple tv disney due launch nov nov respectively investors fail realize however viewers able watch apple tv disney roku devices connected tvs services launch since thats case roku benefit launch services competition secular shift secret streaming technology moved forefront pushing broadcast cable television aside days families gathered around box prescribed time watch show going way vcr cassette landline telephone paradigm shift began decade ago netflix nasdaqnflx introduced streaming video consumers quickly realized could watch favorite programs schedule one dictated networks youre looking proof viewers adopting streaming video increasing numbers look tech giants massive subscriber count netflix topped million third quarter one netflix isnt one gaining massive following second quarter rokus active accounts grew million year year streaming hours soared billion time rokus platform segment primarily advertising grew million whopping year year represents twothirds companys revenue rokus claim fame among consumers however agnostic platform supporting paid streaming services also adsupported options roku offers thousands apps allows consumers customize viewing experience choosing programming wide variety providers viewers watch paid platforms including netflix amazoncom prime video disneycontrolled hulu well adsupported fare altice usas cheddar viacoms pluto tv sonys crackle growing multiple fronts investors doubt equate roku namesake streaming boxes company made number changes past couple years give roku numerous ways enrich shareholders several years ago roku made decision pivot streaming media players focus platform business includes advertising connected tv operating system os roku channel threepronged approach platform segment helps feed growing advertising business company licenses os connected tv manufacturers system found one three connected tvs sold united states gives roku massive installed base devices including players dongles use show advertising viewers roku channel providing additional source ad revenue advertising rokus fastest growing business company recently acquired demandside advertising platform dataxu million deal fuel companys push ad sales massive opportunity would easy look solely stock price gains far year take pass especially since roku remains unprofitable pricetosales ratio trailingmonth period far higher average valuation peers internet services social media industry netflix became leading subscription streaming service first scene becoming ubiquitous roku similar opportunity massive aggregator content benefiting getting cut advertising adsupported providers stream platform investors consider massive opportunity ahead dismissing roku outright basis soaring gains far year,3
25,11/02/2019,amzn,https://www.fool.com/investing/2019/11/02/amazon-delivers-groceries-for-free-but-kroger-stil.aspx,"Amazon Delivers Groceries for Free, But Kroger Still Delivers for Investors",amazon nasdaqamzn bought whole foods billion boost grocery sales offering free twohour delivery groceries prime members move part amazons effort compete kroger nysekr supermarket chains previously amazon charged monthly fee unlimited grocery delivery addition annual prime membership prime members get free delivery amazon fresh available cities whole foods amazon million prime members us kroger fights back amazons announcement tuesday krogers shares dropped isnt first time krogers shares dropped following amazon move march news amazons foray retail stores sunk krogers shares kroger countered numerous strategies including investing heavily ecommerce home delivery initiatives kroger charges delivery delivery fee service fee expanded home delivery customer pickup services supermarket chain offers home delivery stores customer pickup locations covering households market area grocer also launched kroger rush delivery service needitnow items delivered minutes costs per delivery kroger pursuing alternative profit streams including kroger personal finance kroger media ° data analytics unit kroger expects ventures contribute estimated incremental million operating profit compared kroger sees personal finance offerings way increase traffic customer loyalty ° unit key competitive weapon helping compete data powerhouse amazon inhouse analytics firm recently deployed kroger precision marketing uses customer purchase data grocers million shopper households launch marketing programs across digital spectrum kroger partnered recently microsoft nasdaqmsft pilot two datadriven connected stores guide shoppers aisles products want buy kroger investing money resources backend partnership uk online grocer ocado september kroger identified dallas fifth location build automated warehouse fulfill online grocery orders automated warehouses called customer fulfillment centers cfc use digital robotic technology fill grocery orders kroger ocado announced partnership may companies said plan open cfcs us next three years amazon opening new concept grocery stores kroger devoting resources online business amazon putting money brick mortar amazon aims compete kroger grocers chain stores across us earlier month announced plans open dozens stores starting los angeles chicago philadelphia stores operate separately whole foods focuses organic items likely feature prepared foods well grocery items outdone kroger offering consumers reasons visit stores course spend money theyre business insider reported kroger working united parcel service nyseups us postal service fedex nysefdx bring packagedelivery services stores kroger package services select kroger stores accept packages including require signatures store secure area customers pick kps also allow kroger shoppers drop prelabeled packages bring unboxed items shipping lets go krogering amazon may retail behemoth casts huge shadow traditional grocery stores kroger giant right largest supermarket chain revenue us nations secondlargest general retailer boasting stores states kroger priceearnings ratio significantly lower market average pe companies consumer retailing industry probably indicates market pessimism relatively modest earning per share growth around year past five years also means could undervalued pretty low price amazon news may mean time put shares cart,3
