,date,core_search_term,link,title,text,cluster_assignment_with_9_clusters
23,11/02/2019,amzn,https://www.fool.com/investing/2019/11/02/roku-doubles-down-on-advertising-tech.aspx,Roku Doubles Down on Advertising Tech,roku nasdaqroku essentially invented business space finds roku created first netflix player little box could plug regular old dumb tv make smart device hit company soon making money selling devices ran eponymous platform companies soon created streaming platforms including amazon nasdaqamzn alphabet plenty ways monetize platform could afford sell hardware cheap even loss roku needed reliable source income hardware sales company found source advertising last week roku doubled advertising ambitions major acquisition rokus new acquisition roku buying dataxu boston company specializes advertising technology million cash stock thats pretty good deal relative long ago dataxu hoped get important price tag least roku potential dataxus platform take rokus adselling operation next level dataxus platform demandside platform demandside platform one built digital ad buyers buyers view data bid advertising spots realtime ideally offers powerful adtargeting analytics tools ad buyers also making easy buyers bid advertising opportunities spend lots money crucially demandside platform acts hub connects multiple ad buyers multiple ad publishers rokus advertising platform isnt ads appear roku platforms home page also ads published partners like viacom clear roku already advertising platform roku ceo anthony wood says dataxu acquisition accelerate rokus advertising platform roughly dataxu employees coming roku fold bring innovations well rokus big audience easy see advertising would valuable roku roku biggest player streaming platform scene measures anyway despite amazons claims contrary user base massive audience valuable advertisers roku irons fire company met success smart tv space started roku channel free adsupported video demand avod service deals place streaming services exchange places roku menus shortcut buttons roku remotes advertising clear top priority best bet rokus future moreover areas tend tie back advertising way obvious case roku channel avod service rokus focus ads made sense start still makes sense various ways monetize streaming platform ads among least disruptive fans dont like ads ads still served without making roku less serviceagnostic platform contrast major techbacked platforms like amazons fire tv googles android tv less serviceagnostic tend push offerings amazon google respectively makes effective way monetize platform allow maintain sort sage neutrality roku projects plus less agnostic sometimes draws ire competition witness disneys almost certainly deliberate decision leave fire tv disney launch combine logic relatively appealing price dataxu acquisition smart move roku,0
21,11/01/2019,amzn,https://stocknews.com/news/inx-are-stocks-only-1-from-the-top/,.INX: Are Stocks Only 1% from the Top?,join thousands investors get latest news insights top rated picks stocknewscom stock market making new highs friday because… jobs added october announced need jobs added month keep population growth average earnings decline q announcements noted factset ism manufacturing nd straight month contraction territory ok…i kidding know investors paying zero attention fundamentals time speed bumps ineffective slowing investors thing minds odds trade deal coming together china yes took another positive step forward friday chinese administration said come agreement us core points deal progress forward exact date signing still question mark…but likely resolved soon begs vital questions market address question high stocks go without trade deal hand pondered question last week stated likely limit market upside without deal finalized prediction still seems target today remember every points sp proven important level resistance market time would different yes friday’s close however consider far run point including rally october rd low year date gain light near term top bad question happens trade deal signed stocks likely burst higher news like sudden sprint new record highs bet would extended bout profit taking nothing ominous meant statement market often needs take step back digest gains hand ready move forward pullback would standard operating procedure please remember market typically rallies anticipation types positive events explains gain last month alone fact upside limited traders would want lock gains extended round selling question stocks trade deal falls apart exhibit cratering market end july sides last pushed away trading table probably would get repeat nasty sell maybe worse economic data much weaker time seem two sides concert trade deal corroboration china today refreshing sign it’s us administration talking likelihood deal unfortunately always bad headline away triggering sell means sleep one eye open negative turn events cautious optimism right approach next keep looking healthiest stocks add portfolio links point right direction stock week top breakout momentum stocks reitmeister total return portfolio wishing world investment success steve reitmeister …but friends call reity pronounced “righty” ceo stock news network editor reitmeister total return inx shares rose afterhours trading friday yeartodate inx gained versus rise benchmark sp index period author steve reitmeister steve better known stocknews audience “reity” ceo firm also shares years investment experience reitmeister total return portfolio learn reity’s background along links recent articles stock picks resources stocks article,1
46,11/05/2019,amzn,https://www.fool.com/investing/2019/11/05/apples-earnings-fell-year-over-year-3-reasons-why.aspx,Apple's Earnings Fell Year-Over-Year: 3 Reasons Why It's Still a Buy,apple inc nasdaqaapl reported fullyear earnings first glance appears well apples flagship product iphone saw sales decline nearly yearoveryear iconic product forms total revenue year ago sales mac ipads yearoveryear insufficient match fall revenue iphone theres bad news apples gross margins contracted percentage points net income declined yearoveryear chiefly due higher levels research development expenses sga costs however theres silver lining seemingly dismal set earnings three reasons tech giant remains attractive strong growth wearables apple reported strong yearoveryear growth wearables home accessories include items apple watch airpods beats products segment makes total revenue year ago interestingly segments sales surpassed sales ipads inching close macs revenue numbers reason get excited wearables segment represents future tech products headed easytouse portable convenient idc forecast market wearables track hit million units year set grow annually hit million though apple break number units sells wearables division forecast nevertheless bodes well division signals steady growth years ahead apple watch series opens opportunities healthcare apple watch one apples key wearable products tim cook reiterated apples commitment focusing users fitness health watchos contains new features cycle tracking activity trends help users better track monitor fitness levels remember ecg feature apple introduced series feature available markets including india allows users check measure heart rate fdaapproved feature one many initiatives apple undertaking monitor customers health statistics ecg picks abnormalities users consult doctor tests treatment options apple shows huge potential healthfocused apple watch world waking importance healthier living tech giants collaborations leading health institutions well new research app paired medical studies hearing heart womens health paves way potential medical discoveries breakthroughs cementing apples place healthcare industry services division broke records apples services division grew yearoveryear makes apples revenue fy according tim cook ceo apple app store music cloud services hit new alltime records company well way doubling fy services revenue apple pay revenue transactions doubled billion transactions q exceeding paypal holdings nasdaqpypl number transactions also displaying four times faster growth apple arcade launched september giving subscribers unlimited access personalized selection games developers around world services revenue tends recurring nature apples plans grow division building ecosystem loyal users great way stabilize revenue earnings make less volatile services grow importance years investors also remember provide uplift apples gross profit margin services gross profit margin almost double products versus future remains exciting apple apple continuously rolling new services order boost services revenue apple tv set launched countries regions apples first alloriginal video subscription service compete netflixs original offerings amazon prime video amazoncom though may speed bumps along way company apples future remains exciting cant wait see else tech giant offer,1
43,11/05/2019,amzn,https://www.businesswire.com/news/home/20191105006103/en/Highly-Anticipated-Animated-Series-Critical-Role-The-Legend-of-Vox-Machina-to-Exclusively-Stream-on-Amazon-Prime-Video,Highly Anticipated Animated Series Critical Role: The Legend ...,culver city califbusiness wirenasdaqamzn — amazon prime video along critical role today announced service exclusive streaming home upcoming animated series critical role legend vox machina based adventures characters critical role leading storydriven worldbuilding digital media brand amazon studios ordered two seasons series also closed firstlook deal critical role develop new series premiere exclusively prime video countries territories worldwide content agreement builds longstanding engagement critical role amazon’s livestreaming service twitch broadcast wildly successful live roleplaying show since earlier year critical role launched legend vox machina kickstarter campaign minute animated special produced titmouse reaching original funding goal within minutes campaign continued gain traction thanks critical role’s passionate fanbase becoming mostfunded tv film animated project kickstarter history raising enough fund episode season new agreement prime video build recordbreaking support ordering additional episodes total episodes across two seasons stream exclusively service critical role legend vox machina follows group secondrate drunken adventurers quest save realm terrifying monsters dark magical forces discover become found family process adult animated actioncomedy series fantasy universe starring original characters critical role “we absolutely floored level enthusiasm received kickstarter campaign deliver exactly fans wanted more” said sam riegel travis willingham cast members critical role executive producers series “teaming prime video deliver series fans across globe exciting surreal we’re psyched able tell even stories one two episode seasons” “critical role blazed new trail original digital content fresh new voices humor earned devoted fans around world evidenced wildly successful kickstarter campaign” said jennifer salke head amazon studios “we’re thrilled work whole team bring legend vox machina new critical role series prime video customers” chris prynoski titmouse president founder added “i’ve wanting make animated show based fantasy role playing games since st level i’m overjoyed titmouse join critical role adventuring party slay beast alongside mighty amazon army” critical role legend vox machina stars critical role cast laura bailey taliesin jaffe ashley johnson liam o’brien matthew mercer marisha ray sam riegel travis willingham reprising roles also serve executive producers alongside brandon auman star wars resistance chris prynoski metalocalypse sung jin ahn niko sword light joining supervising director emmy awardwinning studio titmouse animation partner critical role represented caa helped broker deal meet members vox machina critical role legend vox machina they’re rowdy ragtag assortment swords wandsforhire seven wandering dumbasses care easy money cheap ale actually protecting realm home city emon attacked horrific monster realize ones capable avenging neighbors restoring justice united protectors realm follow vox machina venture beyond walls emon battle even darker forces across kingdom throughout first season critical role legend vox machina face undead giants help overthrow sinister necromancer confront powerful curse taken root inside group learn function team discover they’re much they’re family critical role critical role popular storydriven worldbuilding digital media brand world started roleplaying game friends evolved multiplatform entertainment phenomenon variety shows including flagship show critical role comic books graphic novels animation live performances podcasts fan art passionate engaged community tunes week watch favorite storytellers take new adventures led veteran voice actor matthew mercer composed wellknown voice actors ashley johnson marisha ray taliesin jaffe travis willingham sam riegel laura bailey liam obrien engrossed stories characters camaraderie half million regular viewers watch every week hundreds thousands per month continue discover critical role first time information critical role go wwwcritrolecom prime video prime video premium streaming service offers customers vast collection digital videos—all ease finding love watch one place included prime watch thousands popular movies tv shows including criticallyacclaimed amazon originals including emmy awardwinning marvelous mrs maisel tom clancy’s jack ryan boys carnival row homecoming hanna fleabag good omens donald glover’s guava island academy awardwinning manchester sea salesman academy awardnominated big sick cold war criticallyacclaimed beautiful boy exclusives live sports including thursday night football licensed selfpublished content available countries territories worldwide watch thousands popular movies tv shows including criticallyacclaimed amazon originals including emmy awardwinning donald glover’s academy awardwinning academy awardnominated criticallyacclaimed exclusives live sports including thursday night football licensed selfpublished content available countries territories worldwide watch prime video channels prime members add channels us like hbo cinemax starz showtime cbs access nba league pass mlbtv —no extra apps download cable required pay ones want cancel anytime view full list channels available amazoncomchannels prime members add channels us like hbo cinemax starz showtime cbs access nba league pass mlbtv —no extra apps download cable required pay ones want cancel anytime view full list channels available amazoncomchannels rent buy enjoy hundreds thousands titles including newrelease movies entire seasons current tv episodes available amazon customers rent buy enjoy hundreds thousands titles including newrelease movies entire seasons current tv episodes available amazon customers rent buy instant access watch want prime video app smart tv mobile device fire tv fire tablet apple tv chromecast game consoles comcast x web complete list compatible devices visit amazoncomhowtostream watch want prime video app smart tv mobile device fire tv fire tablet apple tv chromecast game consoles comcast x web complete list compatible devices visit amazoncomhowtostream enhanced experiences make every viewing k ultra hd high dynamic range hdrcompatible content go behind scenes favorite movies tv shows exclusive xray access powered imdb save later select mobile downloads offline viewing addition access movies tv shows included prime prime membership includes unlimited fast free shipping options across categories available amazon two million songs thousands playlists stations prime music secure photo storage prime photos unlimited reading prime reading unlimited access digital audiobook catalogue audible channels prime rotating selection free digital games ingame loot twitch prime early access select lightning deals exclusive access discounts select items signup prime find visit amazoncomprime amazon amazon guided four principles customer obsession rather competitor focus passion invention commitment operational excellence longterm thinking customer reviews click shopping personalized recommendations prime fulfillment amazon aws kindle direct publishing kindle fire tablets fire tv amazon echo alexa products services pioneered amazon information visit amazoncomabout follow amazonnews titmouse titmouse full‐service awardwinning animation production company artistrun studios los angeles new york city vancouver keep talented people industry guaranteed human employed pushing creative boundaries writers producers directors storyboard artists animators compositors editors vr artists right house state‐of‐the‐art sound studio many tv shows films commercial work branded original digital content projects recorded titmouse founders chris shannon prynoski launched titmouse los angeles birthplace american entertainment industry known series venture bros big mouth superjail black dynamite tigtone metalocalypse titmouse creates highquality cartoons ages interests visit us online titmousenet,1
42,11/05/2019,amzn,https://www.fool.com/investing/2019/11/05/stocks-to-watch-in-november.aspx,Stocks to Watch in November,november month cranberry sauce gratitude often means investors wrapping earnings season holiday shopping kick near end month leaving investors knowledge month began datadog nasdaqddog activision blizzard nasdaqatvi amazoncom nasdaqamzn companies making moves month lets see stocks watch november activision blizzard nov diehard gamers fickle isnt activision blizzard best analysts bracing yearoveryear plunge quarterly revenue reports financial results thursday afternoon profits slashed half expectations low recent tensions china activision blizzards move suspend prolific esports personality making comments support hong kong protests polarized gamers investors alike investors hanging hope comes guidance week company rolled call duty modern warfare latest installment combat franchise peaked well call duty mobile smartphone players last month new releases better handle fallout esports suspension insight activision blizzard offers nearterm prospects go long way dictating stocks direction datadog nov last months rough ipo market weve seen prolific offerings come undone opening bell even many big names make trading floor buckled ipo prices investing ipo stocks isnt easy days datadog one recent debutantes still head water cloud monitoring analytics specialist went public midseptember currently trading higher first big test ipo initial earnings report public company datadog come next week lot growth momentum heading next tuesdays report revenue nearly doubled last year risen almost first half large companies hopping onto cloud uptime reigning supreme datadogs growing client base said much customers willing pay platforms crucial insight strong report keep party going datadog naturally things dont go swimmingly top line decelerates sharply impressive dollarbased net retention rate takes breather wouldnt surprise see stock become latest broken ipo hard regain markets confidence burn investors first earnings report public company amazoncom nov timing years thanksgiving holiday going pinch retailers holiday officially kicks telltale shopping season fourth thursday month since falls nov time latest possible start season always ends christmas amazon trying make luck instead following calendar black friday nov worlds largest online retailer launching eightday black friday sale starts week earlier kicking sales nov brilliant giving jump brickandmortar competition thats already reeling etail challenge company continuing speed fulfillment lowering minimum free shipping amazonwarehoused goods things shaping nicely crucial time year,1
7,10/31/2019,amzn,https://finance.yahoo.com/news/how-yeti-has-successfully-navigated-trumps-trade-war-with-china-170206966.html,How Yeti has successfully navigated Trump's trade war with China,preholiday season hat tip yeti ceo matt reintjes since insanely buzzy october ipo new york stock exchange highend cooler king watch reintjes seemingly pulled right strings public company leader reintjes hasn’t gone misguided productline extension rampage please stock analysts often leads disaster consumer products company nope measured expansion customized drinkware dog bowls smoothtothe touch yet durable backpacks pricey meanwhile yeti effect taken second floor dick’s sporting goods stores huge presence drinkware coolers like crowds boatload imitators space since come ride yeti’s coattails see hydro flask importantly investors accounts reintjes successfully navigated president trump’s trade war china yeti historically made bulk products generally surprised wall street group bracing million hit profits year tariffs yeti products mitigating tariff impact “we months mitigating tariffs enacted last september well looked supply chain strategic perspective identified opportunities move suppliers one region another region tariffs came became strategic project became tariff mitigating project” reintjes tells yahoo finance “things aren’t tariffs today started working well year ago scenarios making right longterm strategic decisions rather reactionary” besides china yeti’s products made mexico philippines italy recently reintjes opted bring holiday inventory earlier planned sidestep tariffs yearend efforts paid financial dividends story continues yeti’s adjusted third quarter earnings came cents share thursday beating analyst forecasts cents share sales cooler equipment category rose rose drinkware gross profit margins surged basis points prior year reflecting yeti’s work mitigating tariffs success keeping new competitors bay yeti cofounder roy seiders second left flanked cortec managing partner david schnadig left yeti ceo matt reintjes right rings ceremonial bell companys ipo begins trading floor new york stock exchange thursday oct ap photorichard drew company lifted fullyear earnings outlook share versus previously yeti’s stock past year “on balance expect stock outperform today following release though note weaker implied q guide light consensus coolers equipment performance despite easy compare may offset enthusiasm strong q result” wrote goldman sachs retail analyst alexandra walvis note clients crazy days leading yeti’s much hyped ipo last october reintjes says it’s good able focus running company “i yeti little four years fortunate see business grown grown customers consumers continue evolve getting ipo tumultuous time markets said day lot conviction business brand focused driving longterm sustainable growth year looking wrapping successful feel great” says reintjes also helpful yeti profitable unlike many splashy tech ipos come market since october brian sozzi editoratlarge coanchor first trade yahoo finance follow twitter briansozzi read latest financial business news yahoo finance follow yahoo finance twitter facebook instagram flipboard smartnews linkedin youtube reddit,1
